{
  "name": "unnamed",
  "meta": {
    "langId": "org.mal-lang.vehiclelang",
    "langVersion": "1.0.0"
  },
  "objects": [
    {
      "meta": {
        "existence": 1
      },
      "id": 1,
      "name": "ECU",
      "asset_type": "ECU",
      "attack_steps": [
        {
          "meta": {
            "consequence": 2
          },
          "name": "shutdown",
          "ttc": null
        }
      ],
      "defenses": []
    },
    {
      "meta": {
        "existence": 1
      },
      "id": 2,
      "name": "Attacker",
      "asset_type": "Attacker",
      "attack_steps": [],
      "defenses": []
    }
  ],
  "associations": [
    {
      "meta": {},
      "target_object_id": 2,
      "target_field": "firstSteps",
      "source_object_id": 1,
      "source_field": "access.attacker"
    }
  ],
  "views": [],
  "icons": []
}
